nfull,nabb,ifACM TRANSACTIONS ON GRAPHICS,ACM T GRAPHIC,4.218COMMUNICATIONS OF THE ACM,COMMUN ACM,3.301SIAM Journal on Imaging Sciences,SIAM J IMAGING SCI,2.687IEEE TRANSACTIONS ON MULTIMEDIA,IEEE T MULTIMEDIA,2.536IEEE Transactions on Services Computing,IEEE T SERV COMPUT,2.365JOURNAL OF NETWORK AND COMPUTER APPLICATIONS,J NETW COMPUT APPL,2.331IEEE TRANSACTIONS ON RELIABILITY,IEEE T RELIAB,2.287COMPUTER-AIDED DESIGN,COMPUT AIDED DESIGN,2.149MATHEMATICAL PROGRAMMING,MATH PROGRAM,2.062ACM TRANSACTIONS ON MATHEMATICAL SOFTWARE,ACM T MATH SOFTWARE,1.879INTERNATIONAL JOURNAL OF ELECTRONIC COMMERCE,INT J ELECTRON COMM,1.853JOURNAL OF THE ACM,J ACM,1.803IMAGE AND VISION COMPUTING,IMAGE VISION COMPUT,1.766ADVANCES IN ENGINEERING SOFTWARE,ADV ENG SOFTW,1.673IEEE Transactions on Dependable and Secure Computing,IEEE T DEPEND SECURE,1.592INFORMATION AND SOFTWARE TECHNOLOGY,INFORM SOFTWARE TECH,1.569COMPUTER GRAPHICS FORUM,COMPUT GRAPH FORUM,1.542WORLD WIDE WEB-INTERNET AND WEB INFORMATION SYSTEMS,WORLD WIDE WEB,1.539JOURNAL OF VISUAL COMMUNICATION AND IMAGE REPRESENTATION,J VIS COMMUN IMAGE R,1.53IEEE TRANSACTIONS ON SOFTWARE ENGINEERING,IEEE T SOFTWARE ENG,1.516ACM TRANSACTIONS ON SOFTWARE ENGINEERING AND METHODOLOGY,ACM T SOFTW ENG METH,1.513SIMULATION MODELLING PRACTICE AND THEORY,SIMUL MODEL PRACT TH,1.482JOURNAL OF MATHEMATICAL IMAGING AND VISION,J MATH IMAGING VIS,1.461JOURNAL OF SYSTEMS AND SOFTWARE,J SYST SOFTWARE,1.424IEEE INTERNET COMPUTING,IEEE INTERNET COMPUT,1.4IEEE TRANSACTIONS ON VISUALIZATION AND COMPUTER GRAPHICS,IEEE T VIS COMPUT GR,1.4EMPIRICAL SOFTWARE ENGINEERING,EMPIR SOFTW ENG,1.393MATHEMATICAL AND COMPUTER MODELLING,MATH COMPUT MODEL,1.366IEEE MULTIMEDIA,IEEE MULTIMEDIA,1.361JOURNAL OF FUNCTIONAL PROGRAMMING,J FUNCT PROGRAM,1.357MULTIMEDIA TOOLS AND APPLICATIONS,MULTIMED TOOLS APPL,1.331Automated Software Engineering,AUTOMAT SOFTW ENG,1.312International Journal of Information Security,INT J INF SECUR,1.279Journal of Web Semantics,J WEB SEMANT,1.277COMPUTER STANDARDS & INTERFACES,COMPUT STAND INTER,1.268International Journal of Web and Grid Services,INT J WEB GRID SERV,1.229IEEE COMPUTER GRAPHICS AND APPLICATIONS,IEEE COMPUT GRAPH,1.203BIT NUMERICAL MATHEMATICS,BIT,1.167ACM TRANSACTIONS ON PROGRAMMING LANGUAGES AND SYSTEMS,ACM T PROGR LANG SYS,1.148MATHEMATICS AND COMPUTERS IN SIMULATION,MATH COMPUT SIMULAT,1.124COMPUTERS & GRAPHICS-UK,COMPUT GRAPH-UK,1.12COMPUTER,COMPUTER,1.115REQUIREMENTS ENGINEERING,REQUIR ENG,1.105COMPUTER AIDED GEOMETRIC DESIGN,COMPUT AIDED GEOM D,1.092IEEE MICRO,IEEE MICRO,1.091SOFTWARE TESTING VERIFICATION & RELIABILITY,SOFTW TEST VERIF REL,1.082IT Professional,IT PROF,1.067TSINGHUA SCIENCE AND TECHNOLOGY,TSINGHUA SCI TECHNOL,1.063ACM Transactions on the Web,ACM T WEB,1.061VISUAL COMPUTER,VISUAL COMPUT,1.06ACM Transactions on Storage,ACM T STORAGE,1.033RANDOM STRUCTURES & ALGORITHMS,RANDOM STRUCT ALGOR,1.011ACM Transactions on Knowledge Discovery from Data,ACM T KNOWL DISCOV D,1COMPUTER JOURNAL,COMPUT J,1IEEE Transactions on Computational Intelligence and AI in Games,IEEE T COMP INTEL AI,1Software and Systems Modeling,SOFTW SYST MODEL,0.99ACM Transactions on Multimedia Computing Communications and Applications,ACM T MULTIM COMPUT,0.982THEORY AND PRACTICE OF LOGIC PROGRAMMING,THEOR PRACT LOG PROG,0.952CONCURRENCY AND COMPUTATION-PRACTICE & EXPERIENCE,CONCURR COMP-PRACT E,0.942IEEE SECURITY & PRIVACY,IEEE SECUR PRIV,0.902OPTIMIZATION METHODS & SOFTWARE,OPTIM METHOD SOFTW,0.841SCIENCE OF COMPUTER PROGRAMMING,SCI COMPUT PROGRAM,0.828GRAPHICAL MODELS,GRAPH MODELS,0.821ACM TRANSACTIONS ON DESIGN AUTOMATION OF ELECTRONIC SYSTEMS,ACM T DES AUTOMAT EL,0.82IEEE SOFTWARE,IEEE SOFTWARE,0.82ALGORITHMICA,ALGORITHMICA,0.795PRESENCE-TELEOPERATORS AND VIRTUAL ENVIRONMENTS,PRESENCE-TELEOP VIRT,0.789SOFTWARE QUALITY JOURNAL,SOFTWARE QUAL J,0.787Journal of Software-Evolution and Process,J SOFTW-EVOL PROC,0.729ACM Transactions on Embedded Computing Systems,ACM T EMBED COMPUT S,0.714ACM Transactions on Internet Technology,ACM T INTERNET TECHN,0.705SIGMOD RECORD,SIGMOD REC,0.698JOURNAL OF SYSTEMS ARCHITECTURE,J SYST ARCHITECT,0.683Frontiers of Computer Science,FRONT COMPUT SCI-CHI,0.66FUNDAMENTA INFORMATICAE,FUND INFORM,0.658SOFTWARE-PRACTICE & EXPERIENCE,SOFTWARE PRACT EXPER,0.652SIMULATION-TRANSACTIONS OF THE SOCIETY FOR MODELING AND SIMULATION INTERNATIONAL,SIMUL-T SOC MOD SIM,0.64Information Visualization,INFORM VISUAL,0.639JOURNAL OF VISUAL LANGUAGES AND COMPUTING,J VISUAL LANG COMPUT,0.634ACM TRANSACTIONS ON DATABASE SYSTEMS,ACM T DATABASE SYST,0.633IBM JOURNAL OF RESEARCH AND DEVELOPMENT,IBM J RES DEV,0.626International Journal of Data Warehousing and Mining,INT J DATA WAREHOUS,0.625Computer Science and Information Systems,COMPUT SCI INF SYST,0.623Journal of Web Engineering,J WEB ENG,0.622VIRTUAL REALITY,VIRTUAL REAL-LONDON,0.568ACM Transactions on Applied Perception,ACM T APPL PERCEPT,0.561COMPUTER LANGUAGES SYSTEMS & STRUCTURES,COMPUT LANG SYST STR,0.556COMPUTER ANIMATION AND VIRTUAL WORLDS,COMPUT ANIMAT VIRT W,0.548JOURNAL OF UNIVERSAL COMPUTER SCIENCE,J UNIVERS COMPUT SCI,0.546DISCRETE MATHEMATICS AND THEORETICAL COMPUTER SCIENCE,DISCRETE MATH THEOR,0.537FORMAL ASPECTS OF COMPUTING,FORM ASP COMPUT,0.521ACM SIGPLAN NOTICES,ACM SIGPLAN NOTICES,0.488JOURNAL OF COMPUTER SCIENCE AND TECHNOLOGY,J COMPUT SCI TECH-CH,0.475IET Software,IET SOFTW,0.473Scientific Programming,SCI PROGRAMMING-NETH,0.455International Journal of Wavelets Multiresolution and Information Processing,INT J WAVELETS MULTI,0.392Journal of Zhejiang University-SCIENCE C-Computers & Electronics,J ZHEJIANG U-SCI C,0.392PROGRAMMING AND COMPUTER SOFTWARE,PROGRAM COMPUT SOFT+,0.39International Journal of Web Services Research,INT J WEB SERV RES,0.257Advances in Computers,ADV COMPUT,0.256INTERNATIONAL JOURNAL OF SOFTWARE ENGINEERING AND KNOWLEDGE ENGINEERING,INT J SOFTW ENG KNOW,0.24IEICE TRANSACTIONS ON INFORMATION AND SYSTEMS,IEICE T INF SYST,0.226ICGA JOURNAL,ICGA J,0.206JOURNAL OF DATABASE MANAGEMENT,J DATABASE MANAGE,0.12DESIGN AUTOMATION FOR EMBEDDED SYSTEMS,DES AUTOM EMBED SYST,0.095Frontiers of Information Technology & Electronic Engineering,FRONT INFORM TECH EL,Not Available