nfull,nabb,ifIEEE Communications Surveys and Tutorials,IEEE COMMUN SURV TUT,9.22MIS QUARTERLY,MIS QUART,5.384JOURNAL OF INFORMATION TECHNOLOGY,J INF TECHNOL,4.775IEEE WIRELESS COMMUNICATIONS,IEEE WIREL COMMUN,4.148Journal of Cheminformatics,J CHEMINFORMATICS,3.949Journal of Chemical Information and Modeling,J CHEM INF MODEL,3.657JOURNAL OF THE AMERICAN MEDICAL INFORMATICS ASSOCIATION,J AM MED INFORM ASSN,3.428INFORMATION SCIENCES,INFORM SCIENCES,3.364JOURNAL OF MANAGEMENT INFORMATION SYSTEMS,J MANAGE INFORM SYST,3.025Internet Research,INTERNET RES,3.017IEEE NETWORK,IEEE NETWORK,2.899EUROPEAN JOURNAL OF INFORMATION SYSTEMS,EUR J INFORM SYST,2.892DATA MINING AND KNOWLEDGE DISCOVERY,DATA MIN KNOWL DISC,2.714DECISION SUPPORT SYSTEMS,DECIS SUPPORT SYST,2.604JOURNAL OF STRATEGIC INFORMATION SYSTEMS,J STRATEGIC INF SYST,2.595IEEE TRANSACTIONS ON MULTIMEDIA,IEEE T MULTIMEDIA,2.536IEEE TRANSACTIONS ON KNOWLEDGE AND DATA ENGINEERING,IEEE T KNOWL DATA EN,2.476IEEE TRANSACTIONS ON MOBILE COMPUTING,IEEE T MOBILE COMPUT,2.456JOURNAL OF THE AMERICAN SOCIETY FOR INFORMATION SCIENCE AND TECHNOLOGY,J AM SOC INF SCI TEC,2.452JOURNAL OF THE AMERICAN SOCIETY FOR INFORMATION SCIENCE AND TECHNOLOGY,J AM SOC INF SCI TEC,2.452ACM Transactions on Intelligent Systems and Technology,ACM T INTEL SYST TEC,2.414IEEE Transactions on Services Computing,IEEE T SERV COMPUT,2.365INTERNATIONAL JOURNAL OF MEDICAL INFORMATICS,INT J MED INFORM,2.363Enterprise Information Systems,ENTERP INF SYST-UK,2.269Journal of Optical Communications and Networking,J OPT COMMUN NETW,2.183INFORMATION & MANAGEMENT,INFORM MANAGE-AMSTER,2.163Electronic Commerce Research and Applications,ELECTRON COMMER R A,2.139IEEE Systems Journal,IEEE SYST J,2.114COMPUTER COMMUNICATIONS,COMPUT COMMUN,2.099IEEE Journal of Biomedical and Health Informatics,IEEE J BIOMED HEALTH,2.093INTERNATIONAL JOURNAL OF GEOGRAPHICAL INFORMATION SCIENCE,INT J GEOGR INF SCI,2.065Business & Information Systems Engineering,BUS INFORM SYST ENG+,2.059Journal of the Association for Information Science and Technology,J ASSOC INF SCI TECH,1.864IEEE PERVASIVE COMPUTING,IEEE PERVAS COMPUT,1.836INFORMATION SYSTEMS,INFORM SYST,1.832JOURNAL OF THE ACM,J ACM,1.803Journal of the Association for Information Systems,J ASSOC INF SYST,1.79Semantic Web,SEMANT WEB,1.786VLDB JOURNAL,VLDB J,1.744IEEE TRANSACTIONS ON INFORMATION THEORY,IEEE T INFORM THEORY,1.737Pervasive and Mobile Computing,PERVASIVE MOB COMPUT,1.719KNOWLEDGE AND INFORMATION SYSTEMS,KNOWL INF SYST,1.702Ad Hoc Networks,AD HOC NETW,1.66COMPUTERS & SECURITY,COMPUT SECUR,1.64IEEE Transactions on Dependable and Secure Computing,IEEE T DEPEND SECURE,1.592INFORMATION AND SOFTWARE TECHNOLOGY,INFORM SOFTWARE TECH,1.569Journal of Grid Computing,J GRID COMPUT,1.561WORLD WIDE WEB-INTERNET AND WEB INFORMATION SYSTEMS,WORLD WIDE WEB,1.539MOBILE NETWORKS & APPLICATIONS,MOBILE NETW APPL,1.538JOURNAL OF VISUAL COMMUNICATION AND IMAGE REPRESENTATION,J VIS COMMUN IMAGE R,1.53Cluster Computing-The Journal of Networks Software Tools and Applications,CLUSTER COMPUT,1.514DATA & KNOWLEDGE ENGINEERING,DATA KNOWL ENG,1.5Personal and Ubiquitous Computing,PERS UBIQUIT COMPUT,1.498Mobile Information Systems,MOB INF SYST,1.462INFORMATION SYSTEMS FRONTIERS,INFORM SYST FRONT,1.45ACM Transactions on Sensor Networks,ACM T SENSOR NETWORK,1.448Computer Networks,COMPUT NETW,1.446MULTIMEDIA SYSTEMS,MULTIMEDIA SYST,1.41ACM SIGCOMM Computer Communication Review,ACM SIGCOMM COMP COM,1.402INFORMATION PROCESSING & MANAGEMENT,INFORM PROCESS MANAG,1.397INFORMATICA,INFORMATICA-LITHUAN,1.386IEEE MULTIMEDIA,IEEE MULTIMEDIA,1.361International Journal of Critical Infrastructure Protection,INT J CRIT INFR PROT,1.351MULTIMEDIA TOOLS AND APPLICATIONS,MULTIMED TOOLS APPL,1.331IEEE Transactions on Network and Service Management,IEEE T NETW SERV MAN,1.296ACM Transactions on Computer-Human Interaction,ACM T COMPUT-HUM INT,1.293International Journal of Information Security,INT J INF SECUR,1.279Journal of Web Semantics,J WEB SEMANT,1.277IEEE Access,IEEE ACCESS,1.27International Journal of Web and Grid Services,INT J WEB GRID SERV,1.229Digital Investigation,DIGIT INVEST,1.211BELL LABS TECHNICAL JOURNAL,BELL LABS TECH J,1.2INTERNATIONAL JOURNAL OF INFORMATION TECHNOLOGY & DECISION MAKING,INT J INF TECH DECIS,1.183ONLINE INFORMATION REVIEW,ONLINE INFORM REV,1.152ASLIB PROCEEDINGS,ASLIB PROC,1.147ASLIB PROCEEDINGS,ASLIB PROC,1.147Optical Switching and Networking,OPT SWITCH NETW,1.137ACM Transactions on Autonomous and Adaptive Systems,ACM T AUTON ADAP SYS,1.118REQUIREMENTS ENGINEERING,REQUIR ENG,1.105INFORMATION TECHNOLOGY AND LIBRARIES,INFORM TECHNOL LIBR,1.094Journal of Network and Systems Management,J NETW SYST MANAG,1.078IT Professional,IT PROF,1.067TSINGHUA SCIENCE AND TECHNOLOGY,TSINGHUA SCI TECHNOL,1.063ACM Transactions on the Web,ACM T WEB,1.061GEOINFORMATICA,GEOINFORMATICA,1.061INFORMATION SYSTEMS MANAGEMENT,INFORM SYST MANAGE,1.021IET Information Security,IET INFORM SECUR,1.013WIRELESS NETWORKS,WIREL NETW,1.006ACM Transactions on Knowledge Discovery from Data,ACM T KNOWL DISCOV D,1COMPUTER JOURNAL,COMPUT J,1JOURNAL OF INTELLIGENT INFORMATION SYSTEMS,J INTELL INF SYST,1PROGRAM-ELECTRONIC LIBRARY AND INFORMATION SYSTEMS,PROGRAM-ELECTRON LIB,1Peer-to-Peer Networking and Applications,PEER PEER NETW APPL,1ACM Transactions on Multimedia Computing Communications and Applications,ACM T MULTIM COMPUT,0.982ACM TRANSACTIONS ON INFORMATION SYSTEMS,ACM T INFORM SYST,0.977JOURNAL OF ORGANIZATIONAL COMPUTING AND ELECTRONIC COMMERCE,J ORG COMP ELECT COM,0.944WIRELESS COMMUNICATIONS & MOBILE COMPUTING,WIREL COMMUN MOB COM,0.922JOURNAL OF COMMUNICATIONS AND NETWORKS,J COMMUN NETW-S KOR,0.92International Journal of Distributed Sensor Networks,INT J DISTRIB SENS N,0.906IEEE SECURITY & PRIVACY,IEEE SECUR PRIV,0.902Information Retrieval Journal,INFORM RETRIEVAL J,0.896Science China-Information Sciences,SCI CHINA INFORM SCI,0.885JOURNAL OF INFORMATION SCIENCE,J INF SCI,0.878Journal of Ambient Intelligence and Humanized Computing,J AMB INTEL HUM COMP,0.835Security and Communication Networks,SECUR COMMUN NETW,0.806DISTRIBUTED AND PARALLEL DATABASES,DISTRIB PARALLEL DAT,0.8JOURNAL OF COMPUTER INFORMATION SYSTEMS,J COMPUT INFORM SYST,0.764ACM Transactions on Information and System Security,ACM T INFORM SYST SE,0.759ACTA INFORMATICA,ACTA INFORM,0.722Journal of Ambient Intelligence and Smart Environments,J AMB INTEL SMART EN,0.707ACM Transactions on Internet Technology,ACM T INTERNET TECHN,0.705SIGMOD RECORD,SIGMOD REC,0.698International Journal of Network Management,INT J NETW MANAG,0.681Aslib Journal of Information Management,ASLIB J INFORM MANAG,0.676Frontiers of Computer Science,FRONT COMPUT SCI-CHI,0.66ACM TRANSACTIONS ON DATABASE SYSTEMS,ACM T DATABASE SYST,0.633Information Technology and Control,INF TECHNOL CONTROL,0.633International Journal of Computers Communications & Control,INT J COMPUT COMMUN,0.627IBM JOURNAL OF RESEARCH AND DEVELOPMENT,IBM J RES DEV,0.626Computer Science and Information Systems,COMPUT SCI INF SYST,0.623International Journal on Semantic Web and Information Systems,INT J SEMANT WEB INF,0.621INFORMATION PROCESSING LETTERS,INFORM PROCESS LETT,0.605Foundations and Trends in Information Retrieval,FOUND TRENDS INF RET,0.6Ad Hoc & Sensor Wireless Networks,AD HOC SENS WIREL NE,0.587Sustainable Computing-Informatics & Systems,SUSTAIN COMPUT-INFOR,0.569PHOTONIC NETWORK COMMUNICATIONS,PHOTONIC NETW COMMUN,0.557Journal of Internet Technology,J INTERNET TECHNOL,0.533New Review of Hypermedia and Multimedia,NEW REV HYPERMEDIA M,0.533Applied Ontology,APPL ONTOL,0.526INTERNATIONAL JOURNAL OF COOPERATIVE INFORMATION SYSTEMS,INT J COOP INF SYST,0.526International Arab Journal of Information Technology,INT ARAB J INF TECHN,0.519Journal of Signal Processing Systems for Signal Image and Video Technology,J SIGNAL PROCESS SYS,0.508International Journal of Ad Hoc and Ubiquitous Computing,INT J AD HOC UBIQ CO,0.489International Journal of Sensor Networks,INT J SENS NETW,0.454IEEE Latin America Transactions,IEEE LAT AM T,0.436JOURNAL OF INFORMATION SCIENCE AND ENGINEERING,J INF SCI ENG,0.392Journal of Zhejiang University-SCIENCE C-Computers & Electronics,J ZHEJIANG U-SCI C,0.392KSII Transactions on Internet and Information Systems,KSII T INTERNET INF,0.365RAIRO-THEORETICAL INFORMATICS AND APPLICATIONS,RAIRO-THEOR INF APPL,0.319International Journal of Web Services Research,INT J WEB SERV RES,0.257IEICE TRANSACTIONS ON FUNDAMENTALS OF ELECTRONICS COMMUNICATIONS AND COMPUTER SCIENCES,IEICE T FUND ELECTR,0.236IEICE TRANSACTIONS ON INFORMATION AND SYSTEMS,IEICE T INF SYST,0.226Journal of Organizational and End User Computing,J ORGAN END USER COM,0.156JOURNAL OF DATABASE MANAGEMENT,J DATABASE MANAGE,0.12INFOR,INFOR,0.095Frontiers of Information Technology & Electronic Engineering,FRONT INFORM TECH EL,Not Available